{
  "schema_version": 1,
  "server_key": "devhub_delegate",
  "raw_tool": "devhub_delegate",
  "canonical_namespace": "mcp__devhub_delegate",
  "canonical_function": "devhub_delegate",
  "allowed_tools": [
    "mcp__devhub_delegate.devhub_delegate"
  ],
  "expected_mcp_server_config_sha256": "ff866e1aea6710de0373474e6671dbd412173a11cf0284c321e20c5b47ce199b",
  "expected_input_schema": {
    "additionalProperties": false,
    "properties": {
      "schema_version": {
        "const": 1,
        "default": 1,
        "title": "Schema Version",
        "type": "integer"
      },
      "task_id": {
        "maxLength": 64,
        "minLength": 1,
        "pattern": "^[A-Za-z0-9_-]+$",
        "title": "Task Id",
        "type": "string"
      },
      "request_key": {
        "maxLength": 64,
        "minLength": 1,
        "pattern": "^[A-Za-z0-9_-]+$",
        "title": "Request Key",
        "type": "string"
      },
      "instructions": {
        "maxLength": 64000,
        "minLength": 1,
        "title": "Instructions",
        "type": "string"
      },
      "acceptance_criteria": {
        "items": {
          "maxLength": 8000,
          "minLength": 1,
          "type": "string"
        },
        "maxItems": 15,
        "minItems": 1,
        "title": "Acceptance Criteria",
        "type": "array"
      },
      "query": {
        "maxLength": 2000,
        "minLength": 1,
        "title": "Query",
        "type": "string"
      },
      "project": {
        "maxLength": 64,
        "minLength": 1,
        "pattern": "^[A-Za-z0-9_-]+$",
        "title": "Project",
        "type": "string"
      },
      "task_class": {
        "default": "summarize",
        "enum": [
          "summarize",
          "explain",
          "extract"
        ],
        "title": "Task Class",
        "type": "string"
      },
      "privacy": {
        "default": "local_only",
        "enum": [
          "local_only",
          "project_private",
          "public",
          "redacted"
        ],
        "title": "Privacy",
        "type": "string"
      },
      "allow_cloud": {
        "default": false,
        "title": "Allow Cloud",
        "type": "boolean"
      },
      "require_citations": {
        "default": true,
        "title": "Require Citations",
        "type": "boolean"
      }
    },
    "required": [
      "task_id",
      "request_key",
      "instructions",
      "acceptance_criteria",
      "query",
      "project"
    ],
    "title": "DelegationRequest",
    "type": "object"
  },
  "expected_input_schema_sha256": "0f06b9fc3d912389721413789835053eefb2db7cc14781829bd57234c7e371be",
  "direct_only_tool_namespaces": [
    "mcp__devhub_delegate"
  ],
  "expected_global_tool_mode": "CodeModeOnly",
  "error_on_tool_collisions": true
}
